{
  "$schema": "https://json-schema.org/draft/2020-12/schema",
  "$id": "https://raw.githubusercontent.com/Chicago-Offline/codeplugger/main/schemas/capabilities-0.2.schema.json",
  "title": "Codeplugger radio capabilities",
  "description": "Describes what a target radio can physically accept. Scoped to facts a generator needs in order to decide whether a profile will fit and work on the radio, not to model the radio's full feature set.",
  "type": "object",
  "required": [
    "id",
    "name",
    "limits"
  ],
  "additionalProperties": false,
  "properties": {
    "id": {
      "type": "string",
      "description": "Stable radio identifier; must match the containing directory name.",
      "pattern": "^[a-z0-9_]+$"
    },
    "name": {
      "type": "string",
      "description": "Human-readable radio name.",
      "minLength": 1
    },
    "capabilities_version": {
      "type": "string",
      "description": "Schema version this document targets.",
      "const": "0.2"
    },
    "zone_banks": {
      "type": "integer",
      "description": "Number of channel banks a zone has on this radio. TyT OEM firmware binds one bank per VFO and renders the second display line from bank B, so a dual-bank radio needs both banks populated. Defaults to 1 when absent.",
      "minimum": 1,
      "maximum": 2
    },
    "limits": {
      "type": "object",
      "description": "Hard structural limits enforced against a resolved profile.",
      "required": [
        "max_channels",
        "max_zones",
        "max_channels_per_zone"
      ],
      "additionalProperties": false,
      "properties": {
        "max_channels": {
          "type": "integer",
          "minimum": 1,
          "description": "Total channels the radio can store."
        },
        "max_zones": {
          "type": "integer",
          "minimum": 0,
          "description": "Zones the radio can store. 0 means the radio has no zone concept."
        },
        "max_channels_per_zone": {
          "type": "integer",
          "minimum": 1,
          "description": "Channels a single zone can hold."
        },
        "max_scan_lists": {
          "type": "integer",
          "minimum": 0,
          "description": "Scan lists the radio can store. Omit when unknown."
        },
        "max_channels_per_scan_list": {
          "type": "integer",
          "minimum": 1,
          "description": "Channels a single scan list can hold. This is the on-radio storage capacity, which may be smaller than the count a CPS UI appears to offer. Omit when unknown."
        },
        "max_rx_group_lists": {
          "type": "integer",
          "minimum": 0,
          "description": "DMR RX group lists the radio can store. Omit when unknown."
        },
        "max_talkgroups_per_rx_group_list": {
          "type": "integer",
          "minimum": 1,
          "description": "Talkgroups a single DMR RX group list can hold. Omit when unknown."
        },
        "max_contacts": {
          "type": "integer",
          "minimum": 0,
          "description": "Contacts the radio can store. Omit when unknown."
        },
        "max_dmr_ids": {
          "type": "integer",
          "minimum": 0,
          "description": "Distinct DMR radio IDs the radio can store."
        },
        "max_channel_name_chars": {
          "type": "integer",
          "minimum": 1,
          "description": "Characters a channel display name can hold. Names longer than this may be silently truncated by the CPS or on-radio encoder rather than rejected. Omit when unknown."
        },
        "max_zone_name_chars": {
          "type": "integer",
          "minimum": 1,
          "description": "Characters a zone name can hold. Omit when unknown."
        },
        "max_scan_list_name_chars": {
          "type": "integer",
          "minimum": 1,
          "description": "Characters a scan list name can hold. Omit when unknown."
        },
        "max_contact_name_chars": {
          "type": "integer",
          "minimum": 1,
          "description": "Characters a contact name can hold. Omit when unknown."
        }
      }
    },
    "firmware_limits": {
      "type": "object",
      "description": "Per-firmware limit overrides. Keys are firmware version strings as reported by the radio (e.g. \"DM32.01.01.049\"). A profile validated without a known firmware uses `limits` intersected with every override here, so an unknown firmware cannot validate against a capacity no shipped firmware provides.",
      "propertyNames": {
        "pattern": "^[A-Za-z0-9][A-Za-z0-9._-]*$"
      },
      "minProperties": 1,
      "additionalProperties": {
        "$ref": "#/$defs/firmwareLimitOverrides"
      }
    },
    "bands": {
      "type": "array",
      "description": "Frequency ranges the radio can tune, in MHz. A channel whose RX or TX frequency falls outside every listed band cannot work on this radio. Omit when unknown; validation is then skipped rather than assumed.",
      "minItems": 1,
      "items": {
        "type": "object",
        "required": [
          "min_mhz",
          "max_mhz"
        ],
        "additionalProperties": false,
        "properties": {
          "min_mhz": {
            "type": "number",
            "exclusiveMinimum": 0,
            "description": "Inclusive lower bound in MHz."
          },
          "max_mhz": {
            "type": "number",
            "exclusiveMinimum": 0,
            "description": "Inclusive upper bound in MHz."
          },
          "name": {
            "type": "string",
            "description": "Optional label, e.g. 'VHF' or 'UHF'."
          },
          "rx_only": {
            "type": "boolean",
            "default": false,
            "description": "Radio can receive but not transmit in this range (e.g. a broadcast or airband RX span)."
          }
        }
      }
    },
    "modes": {
      "type": "array",
      "description": "Channel modes the radio supports. Omit when unknown; validation is then skipped.",
      "minItems": 1,
      "uniqueItems": true,
      "items": {
        "type": "string",
        "enum": [
          "AM",
          "FM",
          "DMR"
        ]
      }
    },
    "bandwidths_khz": {
      "type": "array",
      "description": "Analog FM channel bandwidths the radio supports, in kHz. Omit when unknown; validation is then skipped.",
      "minItems": 1,
      "uniqueItems": true,
      "items": {
        "type": "number",
        "exclusiveMinimum": 0
      }
    },
    "notes": {
      "type": "string",
      "description": "Free-form provenance or caveats, e.g. where the figures were sourced."
    },
    "chirp": {
      "type": "object",
      "description": "How the `chirp-writer` backend addresses this radio. Omit for radios CHIRP cannot program; the backend then refuses rather than guessing a driver.",
      "required": [
        "driver",
        "model"
      ],
      "additionalProperties": false,
      "properties": {
        "driver": {
          "type": "string",
          "description": "CHIRP driver name, as printed by `chirp-writer --list-drivers`.",
          "minLength": 1
        },
        "model": {
          "type": "string",
          "description": "The 'Vendor Model' string that driver reports. The backend refuses to write when the connected radio reports anything else. This is often not the name on the case: an FT-270R reports as a Yaesu VX-170.",
          "minLength": 1
        },
        "clone_mode": {
          "type": "string",
          "enum": [
            "on_demand",
            "manual"
          ],
          "default": "on_demand",
          "description": "`on_demand` means the radio answers whenever the cable is connected. `manual` means an operator must put it into clone mode by hand for every read and write, so the backend runs the helper interactively instead of capturing its output.",
          "$comment": "This decides whether a write can be scripted unattended, which is why it lives in capabilities rather than in a profile."
        },
        "driver_upstream": {
          "type": "boolean",
          "default": true,
          "description": "False when the driver is not in released CHIRP yet and must come from a checkout or patch."
        }
      }
    },
    "benlink": {
      "type": "object",
      "description": "How the `benlink` backend reaches and identifies this radio over the Benshi BLE/RFCOMM protocol. Present only for Benshi-protocol radios (Vero VR-N76, BTECH UV-Pro and relatives), which have no programming cable and no CHIRP driver. Omit for every other radio; the backend then refuses rather than guessing a transport.",
      "required": [
        "device_name"
      ],
      "additionalProperties": false,
      "properties": {
        "device_name": {
          "type": "string",
          "description": "Substring of the name the radio advertises over Bluetooth, used to find it during discovery. Case-insensitive.",
          "minLength": 1
        },
        "vendor_id": {
          "type": "integer",
          "minimum": 0,
          "description": "`vendor_id` from the device's own GetDeviceInfo reply. Read it from the radio; do not copy it from a spec sheet."
        },
        "product_id": {
          "type": "integer",
          "minimum": 0,
          "description": "`product_id` from GetDeviceInfo. The backend refuses to write when the connected radio reports anything else, which is the strongest protection available against programming the wrong Benshi-family HT. Absent means never read from hardware, and the backend falls back to the weaker region and channel count check.",
          "$comment": "Optional rather than required because a radio entry can legitimately exist before anyone has connected one; the count check still gates those."
        },
        "transport": {
          "type": "string",
          "enum": [
            "rfcomm",
            "ble"
          ],
          "default": "rfcomm",
          "description": "`rfcomm` is Linux-only (CPython on macOS has no AF_BLUETOOTH) but survives long write sessions. `ble` works on macOS but needs a bonded link created by a foreground GUI process, so it cannot be driven from a daemon or an SSH session.",
          "$comment": "This is a property of how the host must reach the radio, not a user preference, which is why it lives in capabilities."
        },
        "zone_model": {
          "type": "string",
          "enum": [
            "region"
          ],
          "default": "region",
          "description": "Benshi radios partition channels into regions: channel IDs restart at 0 inside each region, so a codeplugger zone is a region and there is no shared global channel pool."
        },
        "hardware_verified": {
          "type": "boolean",
          "default": false,
          "description": "True only once a codeplug has actually been written to this model and read back clean. The backend refuses to program a radio marked false unless the caller explicitly opts in, because the identity gate over Bluetooth is weak: a self-reported product_id at best, and region and channel counts otherwise.",
          "$comment": "Benshi family members share one protocol, so an untested model will appear to work right up until a field means something else on it."
        },
        "verified_firmware_version": {
          "type": "integer",
          "minimum": 0,
          "description": "Firmware version of the unit these limits were actually read from, as reported by GetDeviceInfo. Limits are per-unit on this family, so this records what was measured rather than what is claimed."
        }
      }
    },
    "dmrconf": {
      "type": "object",
      "description": "How the `dmrconf` backend addresses this radio. Present only for radios qdmr can program; omit for a DMR radio that still needs its OEM CPS, so the backend refuses rather than writing a codeplug qdmr would build for a different model.",
      "required": [
        "radio_key"
      ],
      "additionalProperties": false,
      "properties": {
        "radio_key": {
          "type": "string",
          "description": "qdmr radio key, as accepted by `dmrconf verify --radio=<key>` (e.g. `dm32uv`, `dm1701`, `openuv380`). The backend maps it to the device name `dmrconf detect` reports and refuses to write when the connected radio reports anything else.",
          "pattern": "^[a-z0-9]+$"
        },
        "requires_fork": {
          "type": "boolean",
          "default": false,
          "description": "True when the declared behavior needs a qdmr build that is not released yet, so a write may fail against a packaged dmrconf."
        }
      }
    },
    "p64tool": {
      "type": "object",
      "description": "How the `p64tool` backend addresses this radio. The P4 has no from-scratch encoder: a codeplug is produced by editing a baseline decoded from a device, which is why this block records that requirement rather than a model string.",
      "additionalProperties": false,
      "properties": {
        "baseline_required": {
          "type": "boolean",
          "default": true,
          "description": "True when an export needs a `p64tool decode` baseline read from a physical radio. A radio that needs one cannot be built from published data alone, and the build fails rather than publishing a guess."
        }
      }
    }
  },
  "$defs": {
    "firmwareLimitOverrides": {
      "type": "object",
      "description": "Limit overrides for one firmware version. Same keys as `limits`; only the keys that actually change need to be listed. Values replace the base `limits` value, they do not merge per-key.",
      "additionalProperties": false,
      "minProperties": 1,
      "properties": {
        "max_channels": {
          "type": "integer",
          "minimum": 1,
          "description": "Total channels the radio can store."
        },
        "max_zones": {
          "type": "integer",
          "minimum": 0,
          "description": "Zones the radio can store. 0 means the radio has no zone concept."
        },
        "max_channels_per_zone": {
          "type": "integer",
          "minimum": 1,
          "description": "Channels a single zone can hold."
        },
        "max_scan_lists": {
          "type": "integer",
          "minimum": 0,
          "description": "Scan lists the radio can store. Omit when unknown."
        },
        "max_channels_per_scan_list": {
          "type": "integer",
          "minimum": 1,
          "description": "Channels a single scan list can hold. This is the on-radio storage capacity, which may be smaller than the count a CPS UI appears to offer. Omit when unknown."
        },
        "max_rx_group_lists": {
          "type": "integer",
          "minimum": 0,
          "description": "DMR RX group lists the radio can store. Omit when unknown."
        },
        "max_talkgroups_per_rx_group_list": {
          "type": "integer",
          "minimum": 1,
          "description": "Talkgroups a single DMR RX group list can hold. Omit when unknown."
        },
        "max_contacts": {
          "type": "integer",
          "minimum": 0,
          "description": "Contacts the radio can store. Omit when unknown."
        },
        "max_dmr_ids": {
          "type": "integer",
          "minimum": 0,
          "description": "Distinct DMR radio IDs the radio can store."
        },
        "max_channel_name_chars": {
          "type": "integer",
          "minimum": 1,
          "description": "Characters a channel display name can hold. Names longer than this may be silently truncated by the CPS or on-radio encoder rather than rejected. Omit when unknown."
        },
        "max_zone_name_chars": {
          "type": "integer",
          "minimum": 1,
          "description": "Characters a zone name can hold. Omit when unknown."
        },
        "max_scan_list_name_chars": {
          "type": "integer",
          "minimum": 1,
          "description": "Characters a scan list name can hold. Omit when unknown."
        },
        "max_contact_name_chars": {
          "type": "integer",
          "minimum": 1,
          "description": "Characters a contact name can hold. Omit when unknown."
        }
      }
    }
  }
}
